{
  "schema_version": 1,
  "run_id": "cap-004",
  "task_id": "cap-task-002",
  "created_at": "2026-07-10T12:03:00Z",
  "arm": "contract",
  "repetition": 1,
  "agent": { "endpoint": "claude", "model": "opus-5", "config_version": "cfg-a" },
  "task": {
    "repository": "python-cli",
    "base_revision": "base-0002",
    "oracle_revision": "oracle-0002",
    "prompt_fingerprint": "sha256:synthetic-cap-task-002",
    "verification_declared": true
  },
  "result": { "check": "pass", "verify": "fail", "repair_rounds": 2, "replan": true },
  "usage": {
    "reported_tokens": 26000,
    "subscription_quota_delta": 0.09,
    "source": "fixture",
    "source_confidence": "reported"
  },
  "notes": "Synthetic fixture. Not a product-value result."
}
