{
  "schema_version": 1,
  "run_id": "cap-006",
  "task_id": "cap-task-002",
  "created_at": "2026-07-10T12:05:00Z",
  "arm": "no_contract",
  "repetition": 1,
  "agent": { "endpoint": "codex", "model": "gpt-5.5", "config_version": "cfg-a" },
  "task": {
    "repository": "python-cli",
    "base_revision": "base-0002",
    "oracle_revision": "oracle-0002",
    "prompt_fingerprint": "sha256:synthetic-cap-task-002",
    "verification_declared": true
  },
  "result": { "check": "fail", "verify": "fail", "repair_rounds": 3, "replan": true },
  "usage": {
    "reported_tokens": 32000,
    "subscription_quota_delta": 0.12,
    "source": "fixture",
    "source_confidence": "reported"
  },
  "notes": "Synthetic fixture. Not a product-value result."
}
